[
  {"schema_version":"ai-safe2.adapter-manifest.v1","adapter_id":"codex-code-review","name":"Codex Code Review","category":"semantic_review","status":"manifest_only","authority":["observe","recommend"],"capabilities":["correctness-review","regression-review","test-gap-review"],"data_boundary":{"mode":"hosted","source_may_leave_repository":true,"secrets_required":[]},"failure_states":["not_requested","unavailable","failed","produced"],"upgrade":{"channel":"stable","pin":"external_service","automatic_execution":false},"reference":"https://github.com/openai/codex"},
  {"schema_version":"ai-safe2.adapter-manifest.v1","adapter_id":"codex-security","name":"Codex Security","category":"security_review","status":"manifest_only","authority":["observe","recommend"],"capabilities":["security-diff","repository-scan","deep-scan","threat-model"],"data_boundary":{"mode":"hybrid","source_may_leave_repository":true,"secrets_required":[]},"failure_states":["not_requested","unavailable","failed","produced"],"upgrade":{"channel":"stable","pin":"exact_version","automatic_execution":false},"reference":"https://github.com/openai/codex-security"},
  {"schema_version":"ai-safe2.adapter-manifest.v1","adapter_id":"claude-code-review","name":"Claude Code Review","category":"semantic_review","status":"manifest_only","authority":["observe","recommend"],"capabilities":["correctness-review","regression-review","test-gap-review"],"data_boundary":{"mode":"hosted","source_may_leave_repository":true,"secrets_required":[]},"failure_states":["not_requested","unavailable","failed","produced"],"upgrade":{"channel":"stable","pin":"commit_sha","automatic_execution":false},"reference":"https://github.com/anthropics/claude-code-action"},
  {"schema_version":"ai-safe2.adapter-manifest.v1","adapter_id":"claude-security-review","name":"Claude Security Review","category":"security_review","status":"manifest_only","authority":["observe","recommend"],"capabilities":["security-diff","repository-context-review"],"data_boundary":{"mode":"hosted","source_may_leave_repository":true,"secrets_required":[]},"failure_states":["not_requested","unavailable","failed","produced"],"upgrade":{"channel":"stable","pin":"commit_sha","automatic_execution":false},"reference":"https://github.com/anthropics/claude-code-security-review"},
  {"schema_version":"ai-safe2.adapter-manifest.v1","adapter_id":"pr-agent","name":"PR-Agent","category":"semantic_review","status":"manifest_only","authority":["observe","recommend"],"capabilities":["pull-request-review"],"data_boundary":{"mode":"hybrid","source_may_leave_repository":true,"secrets_required":[]},"failure_states":["not_requested","unavailable","failed","produced"],"upgrade":{"channel":"stable","pin":"commit_sha","automatic_execution":false},"reference":"https://github.com/qodo-ai/pr-agent"},
  {"schema_version":"ai-safe2.adapter-manifest.v1","adapter_id":"greptile","name":"Greptile","category":"semantic_review","status":"external","authority":["observe","recommend"],"capabilities":["strategic-integration-review"],"data_boundary":{"mode":"hosted","source_may_leave_repository":true,"secrets_required":[]},"failure_states":["not_requested","unavailable","failed","produced"],"upgrade":{"channel":"deployment_managed","pin":"external_service","automatic_execution":false},"reference":"https://www.greptile.com/"},
  {"schema_version":"ai-safe2.adapter-manifest.v1","adapter_id":"codeql","name":"CodeQL","category":"deterministic","status":"manifest_only","authority":["observe","enforce_existing_policy"],"capabilities":["static-analysis"],"data_boundary":{"mode":"hybrid","source_may_leave_repository":false,"secrets_required":[]},"failure_states":["not_requested","unavailable","failed","produced"],"upgrade":{"channel":"stable","pin":"commit_sha","automatic_execution":false},"reference":"https://github.com/github/codeql-action"},
  {"schema_version":"ai-safe2.adapter-manifest.v1","adapter_id":"semgrep","name":"Semgrep","category":"deterministic","status":"manifest_only","authority":["observe","enforce_existing_policy"],"capabilities":["static-analysis","custom-rules"],"data_boundary":{"mode":"hybrid","source_may_leave_repository":false,"secrets_required":[]},"failure_states":["not_requested","unavailable","failed","produced"],"upgrade":{"channel":"stable","pin":"exact_version","automatic_execution":false},"reference":"https://github.com/semgrep/semgrep"},
  {"schema_version":"ai-safe2.adapter-manifest.v1","adapter_id":"gitleaks","name":"Gitleaks","category":"deterministic","status":"manifest_only","authority":["observe","enforce_existing_policy"],"capabilities":["secret-detection"],"data_boundary":{"mode":"local","source_may_leave_repository":false,"secrets_required":[]},"failure_states":["not_requested","unavailable","failed","produced"],"upgrade":{"channel":"stable","pin":"exact_version","automatic_execution":false},"reference":"https://github.com/gitleaks/gitleaks"},
  {"schema_version":"ai-safe2.adapter-manifest.v1","adapter_id":"nexus","name":"AI SAFE2 NEXUS","category":"runtime","status":"external","authority":["observe","recommend","enforce_existing_policy"],"capabilities":["runtime-trust","delegation-control","distributed-evidence"],"data_boundary":{"mode":"deployment_specific","source_may_leave_repository":false,"secrets_required":[]},"failure_states":["not_requested","unavailable","failed","produced"],"upgrade":{"channel":"manual","pin":"exact_version","automatic_execution":false},"reference":"https://cyberstrategyinstitute.com/ai-safe2/nexus/"},
  {"schema_version":"ai-safe2.adapter-manifest.v1","adapter_id":"mcp-pro","name":"AI SAFE2 MCP Pro","category":"runtime","status":"external","authority":["observe","recommend"],"capabilities":["agent-classification","risk-scoring","framework-mapping","implementation-review"],"data_boundary":{"mode":"hosted","source_may_leave_repository":true,"secrets_required":["AI_SAFE2_MCP_TOKEN"]},"failure_states":["not_requested","unavailable","failed","produced"],"upgrade":{"channel":"deployment_managed","pin":"external_service","automatic_execution":false},"reference":"https://cyberstrategyinstitute.com/ai-safe2/mcp/"},
  {"schema_version":"ai-safe2.adapter-manifest.v1","adapter_id":"agency-check","name":"Agency Check","category":"human_interface","status":"planned","authority":["observe","recommend"],"capabilities":["decision-card","clarification","pause-and-verify"],"data_boundary":{"mode":"hosted","source_may_leave_repository":true,"secrets_required":[]},"failure_states":["not_requested","unavailable","failed","produced"],"upgrade":{"channel":"deployment_managed","pin":"external_service","automatic_execution":false},"reference":"https://cyberstrategyinstitute.com/agency-check/"},
  {"schema_version":"ai-safe2.adapter-manifest.v1","adapter_id":"sovereign-runtime","name":"Sovereign Runtime","category":"runtime","status":"manifest_only","authority":["observe","recommend","enforce_existing_policy"],"capabilities":["runtime-boundary","policy-enforcement","evidence-export"],"data_boundary":{"mode":"deployment_specific","source_may_leave_repository":false,"secrets_required":[]},"failure_states":["not_requested","unavailable","failed","produced"],"upgrade":{"channel":"manual","pin":"exact_version","automatic_execution":false}},
  {"schema_version":"ai-safe2.adapter-manifest.v1","adapter_id":"drift-love-equation","name":"Drift and Love Equation","category":"runtime","status":"manifest_only","authority":["observe","recommend"],"capabilities":["drift-observation","human-alignment-evidence","longitudinal-comparison"],"data_boundary":{"mode":"deployment_specific","source_may_leave_repository":false,"secrets_required":[]},"failure_states":["not_requested","unavailable","failed","produced"],"upgrade":{"channel":"manual","pin":"exact_version","automatic_execution":false}},
  {"schema_version":"ai-safe2.adapter-manifest.v1","adapter_id":"superpowers","name":"Superpowers","category":"method","status":"external","authority":["recommend"],"capabilities":["brainstorming","planning","worktree-isolation","tdd","debugging","verification"],"data_boundary":{"mode":"local","source_may_leave_repository":false,"secrets_required":[]},"failure_states":["not_requested","unavailable","failed","produced"],"upgrade":{"channel":"stable","pin":"commit_sha","automatic_execution":false},"reference":"https://github.com/obra/superpowers"}
]

